{
  "$schema": "https://json-schema.org/draft/2020-12/schema",
  "$id": "urn:ethos:schema:milestone-e-fixture-promotion-criteria:1",
  "title": "Ethos Milestone E fixture-promotion criteria",
  "description": "Source-only pre-alpha Milestone E prep criteria for internal fixture candidate review. This validates criteria shape and vocabulary; candidate-to-criteria alignment stays in the repository guard.",
  "type": "object",
  "required": [
    "schema_version",
    "status",
    "scope",
    "applies_to_inventory",
    "promotion_boundary",
    "public_boundary",
    "global_required_before_internal_demo_plan",
    "criteria"
  ],
  "additionalProperties": false,
  "properties": {
    "schema_version": { "const": 1 },
    "status": { "const": "source-only-pre-alpha-internal-milestone-e-prep" },
    "scope": { "const": "internal_fixture_promotion_criteria" },
    "applies_to_inventory": { "const": "docs/milestone-e-fixture-candidates.json" },
    "promotion_boundary": { "const": "internal_demo_plan_candidate_review_only" },
    "public_boundary": {
      "type": "array",
      "minItems": 10,
      "maxItems": 10,
      "items": { "$ref": "#/$defs/public_boundary" },
      "uniqueItems": true
    },
    "global_required_before_internal_demo_plan": {
      "type": "array",
      "minItems": 8,
      "maxItems": 8,
      "items": { "$ref": "#/$defs/global_requirement" },
      "uniqueItems": true
    },
    "criteria": {
      "type": "array",
      "minItems": 9,
      "maxItems": 9,
      "items": { "$ref": "#/$defs/criteria_case" }
    }
  },
  "$defs": {
    "criteria_case": {
      "type": "object",
      "required": [
        "candidate_id",
        "promotion_status",
        "validation_command_must_pass",
        "required_input_fixtures",
        "diagnostic_boundary_must_remain",
        "blockers_must_remain_explicit"
      ],
      "additionalProperties": false,
      "properties": {
        "candidate_id": { "$ref": "#/$defs/candidate_id" },
        "promotion_status": { "const": "not_promoted_beyond_internal_fixture_planning" },
        "validation_command_must_pass": { "$ref": "#/$defs/validation_command" },
        "required_input_fixtures": {
          "type": "array",
          "minItems": 1,
          "items": { "$ref": "#/$defs/repo_path" },
          "uniqueItems": true
        },
        "diagnostic_boundary_must_remain": { "type": "string", "minLength": 1 },
        "blockers_must_remain_explicit": {
          "type": "array",
          "minItems": 1,
          "items": { "type": "string", "minLength": 1 },
          "uniqueItems": true
        }
      }
    },
    "candidate_id": {
      "type": "string",
      "pattern": "^[a-z0-9]+(?:-[a-z0-9]+)*$"
    },
    "repo_path": {
      "type": "string",
      "minLength": 1,
      "pattern": "^(?:docs/demos/|examples/|fixtures/|schemas/)[A-Za-z0-9_./-]+$"
    },
    "validation_command": {
      "enum": [
        "make milestone-d-capability-downgrade-contract",
        "make milestone-d-internal-contracts",
        "make milestone-d-opendataloader-adapter-shape-contract",
        "make rag-chunk-alpha",
        "make security-report-alpha",
        "make verify-alpha"
      ]
    },
    "public_boundary": {
      "enum": [
        "public reports remain blocked",
        "release artifacts remain blocked",
        "package publication remains blocked",
        "hosted surfaces remain blocked",
        "public result wording remains blocked",
        "performance claims remain blocked",
        "quality claims remain blocked",
        "footprint claims remain blocked",
        "table-quality claims remain blocked",
        "parser-quality claims remain blocked"
      ]
    },
    "global_requirement": {
      "enum": [
        "candidate remains listed in docs/milestone-e-fixture-candidates.json",
        "validated command is rerun in the source checkout",
        "input fixtures remain tracked and path-backed",
        "expected diagnostic boundary remains explicit",
        "blocker status remains explicit",
        "make milestone-e-prep remains green",
        "public-surface posture and claims gates remain green",
        "criteria changes require a validation record or explicit superseding record"
      ]
    }
  }
}
